{
  "schema": "worker-assignment-v1",
  "assignment_id": "assignment-1",
  "run_id": "run-1",
  "attempt": 1,
  "issued_at": "2026-09-01T00:00:00Z",
  "source_snapshot_sha256": "cccccccccccccccccccccccccccccccccccccccccccccccccccccccccccccccc",
  "controller": "android-change-workflow",
  "assignee": {"profile_source": "core", "worker_profile_id": "analysis-reader"},
  "effect": "read_only",
  "objective": "Inspect one file",
  "input_bindings": {"requirement_sha256": "dddddddddddddddddddddddddddddddddddddddddddddddddddddddddddddddd"},
  "scope": {
    "repositories": ["plugin"],
    "paths": [{"repository_id": "plugin", "kind": "file", "path": "README.md"}]
  },
  "constraints": {"max_automatic_escalations": 1, "environment_failure_escalates_model": false},
  "permissions": {
    "may_acquire_authority": false,
    "may_expand_scope": false,
    "may_upload": false,
    "may_accept_gate": false,
    "may_final_accept": false
  },
  "required_evidence": ["readback"],
  "result_schema": "worker-result-v1"
}
